{
  "protocol_version": 1,
  "app_id": "demo-app",
  "env": "staging",
  "release": "1.4.0",
  "sdk_name": "web-report-sdk",
  "sdk_version": "0.1.0",
  "device_id": "3f1c2a4e-8b7d-4c1a-9e2f-0a1b2c3d4e5f",
  "device_id_persistent": false,
  "session_id": "7a6b5c4d-3e2f-4a1b-8c9d-0e1f2a3b4c5d",
  "consent": "unknown",
  "batch_id": "b1a2c3d4-e5f6-4a7b-8c9d-0e1f2a3b4c5e",
  "sent_at": 1793000001000,
  "clock_offset": 0,
  "clock_calibrated": false,
  "common": {
    "page_id": "/list",
    "view_id": "d1e2f3a4-b5c6-4d7e-8f9a-0b1c2d3e4f5a",
    "url": "https://app.example.com/list",
    "sample_rate": 1
  },
  "auth": {
    "app_id": "demo-app",
    "write_token": "wt_placeholder_0000000000000000"
  },
  "events": [
    {
      "event_id": "e0000002-0000-4000-8000-000000000001",
      "event_name": "web_pageview",
      "event_type": "pageview",
      "schema_version": 1,
      "occurred_at": 1793000000600,
      "priority": "normal",
      "dimensions": { "navigation_type": "navigate" },
      "metrics": { "load_time_ms": 812 }
    },
    {
      "event_id": "e0000002-0000-4000-8000-000000000002",
      "event_name": "web_vitals",
      "event_type": "perf",
      "schema_version": 1,
      "occurred_at": 1793000000900,
      "priority": "normal",
      "url": "https://app.example.com/list?page=2",
      "dimensions": { "metric_name": "LCP", "rating": "good" },
      "metrics": { "value": 1840, "delta": 1840 }
    }
  ]
}
