{
  "protocol_version": 1,
  "app_id": "demo-app",
  "env": "staging",
  "release": "1.4.0",
  "sdk_name": "web-report-sdk",
  "sdk_version": "0.1.0",
  "device_id": "3f1c2a4e-8b7d-4c1a-9e2f-0a1b2c3d4e5f",
  "session_id": "7a6b5c4d-3e2f-4a1b-8c9d-0e1f2a3b4c5d",
  "user_id": "placeholder-user-hash-0001",
  "user_id_hashed": true,
  "consent": "granted",
  "batch_id": "b1a2c3d4-e5f6-4a7b-8c9d-0e1f2a3b4c5d",
  "sent_at": 1793000000500,
  "clock_offset": -120,
  "clock_calibrated": true,
  "events": [
    {
      "event_id": "e0000001-0000-4000-8000-000000000001",
      "event_name": "task_submit_complete",
      "event_type": "custom",
      "schema_version": 2,
      "occurred_at": 1793000000000,
      "priority": "critical",
      "sample_rate": 1,
      "page_id": "/task/:id",
      "view_id": "c1d2e3f4-a5b6-4c7d-8e9f-0a1b2c3d4e5f",
      "url": "https://app.example.com/task/123?tab=detail",
      "dimensions": { "task_type": "review", "result": "pass" },
      "metrics": { "duration_ms": 8423, "item_count": 12 }
    },
    {
      "event_id": "e0000001-0000-4000-8000-000000000002",
      "event_name": "web_js_error",
      "event_type": "error",
      "schema_version": 1,
      "occurred_at": 1793000000200,
      "priority": "normal",
      "sample_rate": 0.5,
      "page_id": "/task/:id",
      "view_id": "c1d2e3f4-a5b6-4c7d-8e9f-0a1b2c3d4e5f",
      "url": "https://app.example.com/task/123?tab=detail",
      "dimensions": {
        "error_type": "TypeError",
        "message": "Cannot read properties of undefined (reading 'id')",
        "source": "window_error",
        "fingerprint": "a3f9c2d1"
      },
      "metrics": { "line": 120, "column": 17, "count": 1 },
      "attachment": "TypeError: Cannot read properties of undefined\n    at render (https://app.example.com/assets/index.js:120:17)"
    },
    {
      "event_id": "e0000001-0000-4000-8000-000000000003",
      "event_name": "app_debug_log",
      "event_type": "log",
      "schema_version": 1,
      "occurred_at": 1793000000300,
      "priority": "normal",
      "sample_rate": 1,
      "page_id": "/task/:id",
      "view_id": "c1d2e3f4-a5b6-4c7d-8e9f-0a1b2c3d4e5f",
      "url": "https://app.example.com/task/123?tab=detail",
      "level": "warn",
      "dimensions": { "title": "aaaaaaaaaaaaaaaaaaaaaaaaaaaaaaaaaaaaaaaaaaaaaaaaaaaaaaaaaaaaaaaaaaaaaaaaaaaaaaaaaaaaaaaaaaaaaaaaaaaaaaaaaaaaaaaaaaaaaaaaaaaaaaaaaaaaaaaaaaaaaaaaaaaaaaaaaaaaaaaaaaaaaaaaaaaaaaaaaaaaaaaaaaaaaaaaaaaaaaaaaaaaaaaaaaaaaaaaaaaaaaaaaaaaaaaaaaaaaaaaaaaaaaaaaaaaaaaa" },
      "truncated": ["dimensions.title"],
      "retry_count": 1,
      "replayed": true
    }
  ]
}
