{
  "protocol_version": 1,
  "app_id": "demo-app",
  "env": "staging",
  "release": "1.4.0",
  "sdk_name": "web-report-sdk",
  "sdk_version": "0.1.0",
  "device_id": "3f1c2a4e-8b7d-4c1a-9e2f-0a1b2c3d4e5f",
  "session_id": "7a6b5c4d-3e2f-4a1b-8c9d-0e1f2a3b4c5d",
  "consent": "granted",
  "batch_id": "b1a2c3d4-e5f6-4a7b-8c9d-0e1f2a3b4c60",
  "sent_at": 1793000009000,
  "clock_offset": 0,
  "clock_calibrated": false,
  "auth": { "app_id": "demo-app", "write_token": "placeholder-write-token-0000" },
  "common": {
    "page_id": "/task/:id",
    "view_id": "c1d2e3f4-a5b6-4c7d-8e9f-0a1b2c3d4e5f",
    "url": "https://app.example.com/task/123?tab=detail",
    "sample_rate": 1
  },
  "events": [
    {
      "event_id": "e0000001-0000-4000-8000-000000000010",
      "event_name": "task_submit_complete",
      "event_type": "custom",
      "schema_version": 2,
      "occurred_at": 1793000008800,
      "priority": "critical",
      "dimensions": { "task_type": "review", "result": "pass" },
      "metrics": { "duration_ms": 512 }
    }
  ]
}
